
        {
          "starting_resources" : { "o2" : 10 , "co2" : 10, "nitrogen" : 10, "water" : 10000},
          "power" : {"battery_capacity" : 10000, "stored_power" : 5000},
          "structures" : [
            {
              "type" : "greenhouse",
              "square_meters" : 450
            },
            {
              "type" : "crew quarters",
              "square_meters" : 225
            },
            {
              "type" : "kitchen",
              "square_meters" : 100
            }
          ],
          "starting_plants" : [
            {
              "type" : "wheat",
              "square_meters" : 100
            },
            {
              "type" : "spinach",
              "square_meters" : 100
            },
            {
              "type" : "radish",
              "square_meters" : 100
            },
            {
              "type" : "chard",
              "square_meters" : 50
            }
          ],
          "habitants" : [
            {
              "type" : "human",
              "quantity" : 5
            },
            {
              "type" : "drone",
              "quantity" : 1
            }
          ]
        }